type	first_word	first_word_lemma	first_word_id	second_word	second_word_lemma	second_word_id	full_mwe	full_mwe_lemma	sentence
VERB+PRON	okazało	okazać	7	się	się	8	okazało się	okazać się	Jak ją bardziej przycisnęłam przycisnęła m , okazało się , że nie miała nigdy solowego numeru , tylko fikała nogami w tle , ale i tak było to czymś egzotycznym w stosunku do obecnej sytuacji .
VERB+NOUN	otwiera	otwierać	21	drogę	droga	22	otwiera drogę	otwierać droga	W pierwszym referendum w czerwcu 2001 r . 54 proc . głosujących odrzuciło umowę nicejską , która reformuje Unię Europejską i otwiera drogę do członkostwa Polsce i innym kandydatom .
VERB+PRON	prezentowali	prezentować	2	się	się	3	prezentowali się	prezentować się	Piłkarze Świecia prezentowali się dobrze , ale tworzyli zlepek indywidualistów .
VERB+PRON	Odebrali	odebrać	0	sobie	siebie	1	Odebrali sobie	odebrać siebie	Odebrali sobie życie 13 lutego i 13 marca .
ADJ+ADP	wchodzący	wchodzić	14	w	w	15	wchodzący w	wchodzić w	W piątek ( 3 bm . ) do świnoujskiego portu wojennego wpłynie zespół okrętów wchodzący w skład Sił Natychmiastowego Reagowania NATO .
VERB+NOUN	doznaje	doznawać	10	obrażeń	obrażenie	11	doznaje obrażeń	doznawać obrażenie	Ginie w nich średnio 20 osób , a ponad 200 doznaje obrażeń ciała .
VERB+PRON	Wydaje	wydawać	0	się	się	1	Wydaje się	wydawać się	Wydaje się , że w okresie poprzedzającym Vaticanum II zarysowały się w teologii dwie tendencje : z jednej strony pragnienie ścisłego kontaktu z tradycją , czyli nawrót do źródeł , z drugiej strony konfrontacja i adaptacja chrześcijańskiego posłannictwa do potrzeb współczesnego świata .
VERB+NOUN	miał	mieć	10	wyrzutów	wyrzut	11	miał wyrzutów	mieć wyrzut	""" Jankowski "" , bo taki miał pseudonim , nie miał wyrzutów sumienia , donosząc na prymasa Wyszyńskiego , o . Ziębę , Jacka Kuronia i ks . Popiełuszkę ."
PRON+VERB	się	się	4	znajdować	znajdować	5	się znajdować	się znajdować	Fabryki nowej spółki będą się znajdować we Włoszech , Francji , Wielkiej Brytanii i Hiszpanii .
VERB+NOUN	wzruszyła	wzruszyć	1	ramionami	ramię	2	wzruszyła ramionami	wzruszyć ramię	Przystupa wzruszyła ramionami .
VERB+PRON	ośmielił	ośmielić	9	się	się	10	ośmielił się	ośmielić się	Poszedł tedy Żuraw do chaty i tam dopiero Kuba ośmielił się na świat wyjrzeć , ale od tej pory przestał zupełnie od domu się oddalać , nawet na wabienie rudej zalotnicy .
VERB+PRON	da	dać	6	się	się	7	da się	dać się	Jestem zwolennikiem poglądu , że jeśli da się utrzymać polski charakter instytucji , to należy zdecydowanie działać w tym kierunku .
VERB+PRON	zarył	zaryć	17	się	się	18	zarył się	zaryć się	Rozpalił ognisko , przysmażył ryby , zjadł i poszedł do najbliższej suchej kopy na łące sąsiada , zarył się w nią głęboko i usnął .
ADJ+ADP	mających	mieć	22	za	za	23	mających za	mieć za	Już po raz drugi odbędzie się więc w Lublinie Otwarty Konkurs Fryzjerski dla młodych fryzjerów ( do lat 30 ) i uczniów mających za sobą przynajmniej 3 lata nauki zawodu .
NOUN+ADJ	szkody	szkoda	1	wyrządzone	wyrządzić	2	szkody wyrządzone	szkoda wyrządzić	Za szkody wyrządzone w obwodach łowieckich - leśnych , odszkodowanie wypłacają Lasy Państwowe , a na terenach obwodów łowieckich - polnych i na terenach nie wchodzących w skład obwodów łowieckich - wojewodowie .
ADJ+ADP	wchodzących	wchodzić	25	w	w	26	wchodzących w	wchodzić w	Za szkody wyrządzone w obwodach łowieckich - leśnych , odszkodowanie wypłacają Lasy Państwowe , a na terenach obwodów łowieckich - polnych i na terenach nie wchodzących w skład obwodów łowieckich - wojewodowie .
ADJ+PRON	uwijający	uwijać	19	się	się	20	uwijający się	uwijać się	Był to jeden z najciekawszych w ostatnich latach reality show : buchające wysoko płomienie , kłęby czarnego dymu , uwijający się na drabinach strażacy , strumienie wody płynące z sikawek .
VERB+NOUN	miał	mieć	9	udziału	udział	10	miał udziału	mieć udział	Sekretarz marynarki wojennej , Edwin Denby , choć nie miał udziału w tych łapówkach , został tak zdyskredytowany za swą naiwność i głupotę , że ustąpił z gabinetu .
NOUN+ADP	przyjścia	przyjść	13	na	na	14	przyjścia na	przyjść na	Każde dziecko miało na rączkach identyfikatory z nazwiskiem , oznaczeniem płci i godziną przyjścia na świat .
VERB+PRON	znalazł	znaleźć	2	się	się	3	znalazł się	znaleźć się	W efekcie znalazł się w szpitalu na Srebrzysku .
VERB+NOUN	otrzymała	otrzymać	3	wyróżnienie	wyróżnienie	4	otrzymała wyróżnienie	otrzymać wyróżnienie	Pierwsza z nich otrzymała wyróżnienie za pomocniczy kocioł olejowy do statków , druga za serię maszyn pakujących towar w folię .
VERB+PRON	doczekała	doczekać	5	się	się	6	doczekała się	doczekać się	Teraz ponad 50-tysięczna publiczność nie doczekała się na zbliżone wyczyny ( wyjątek : 231,5 m Norwega w sobotniej serii próbnej ) , bo nie było warunków do bezpiecznego lądowania po tak dalekich lotach .
SCONJ+PRON	Jak	jak	1	się	się	2	Jak się	jak się	- Jak się zwał , tak się zwał , byleby byle by się dobrze miał .
VERB+PUNCT	zwał	zwać	3	,	,	4	zwał ,	zwać ,	- Jak się zwał , tak się zwał , byleby byle by się dobrze miał .
ADV+PRON	tak	tak	5	się	się	6	tak się	tak się	- Jak się zwał , tak się zwał , byleby byle by się dobrze miał .
SCONJ+AUX	byle	byle	10	by	by	11	byle by	byle by	- Jak się zwał , tak się zwał , byleby byle by się dobrze miał .
PRON+ADV	się	się	12	dobrze	dobrze	13	się dobrze	się dobrze	- Jak się zwał , tak się zwał , byleby byle by się dobrze miał .
VERB+PRON	udało	udać	3	się	się	4	udało się	udać się	Również nam nie udało się ustalić , jakie są stawki za wywóz nieczystości .
ADV+PRON	Tak	tak	0	się	się	1	Tak się	tak się	Tak się składa , że obecnie czołówka Ministerstwa Sprawiedliwości dołączyła do opinii publicznej i naturalnie czerpie z tego korzyści propagandowe : nareszcie mamy ministra i prokuratora generalnego , który nie będzie się z przestępcami cackał !
VERB+PRON	stała	stać	9	się	się	10	stała się	stać się	W latach następnych powstały kolejne pensjonaty , a miejscowość stała się modna zwłaszcza po 1932 , kiedy rozbudowano drogę z Białej przez Bystrą i Szczyrk uzyskał stałe połączenie z Bielskiem i Białą .
VERB+PRON	zapowiada	zapowiadać	10	się	się	11	zapowiada się	zapowiadać się	– Gary Guthman doskonale zaaranżował utwory na orkiestrę , dlatego zapowiada się naprawdę fantastyczny koncert – mówi Kułakowska .
VERB+PRON	Cieszę	cieszyć	0	się	się	1	Cieszę się	cieszyć się	Cieszę się , że przy tej okazji mogę spotkać się z chorymi oraz z tymi , którzy im posługują .
VERB+PRON	odezwał	odezwać	3	się	się	4	odezwał się	odezwać się	- Odpocznijmy - odezwał się z tyłu .
NOUN+NOUN	dokonanie	dokonać	4	gwałtu	gwałt	5	dokonanie gwałtu	dokonać gwałt	"Trybunał uznał , że dokonanie gwałtu na kobiecie noszącej obcisłe dżinsy jest niemożliwe , gdyż zdjęcie takich spodni wymaga "" współpracy "" osoby , która ma je na sobie ."
VERB+PRON	odwołuje	odwoływać	7	się	się	8	odwołuje się	odwoływać się	Współczesna socjaldemokracja - a do tej tradycji odwołuje się u nas zarówno SLD , jak i Unia Pracy - nie walczy oczywiście z własnością prywatną .
VERB+PRON	poczuł	poczuć	2	się	się	3	poczuł się	poczuć się	Cichoń znów poczuł się bezpieczniej , komisarz przestał pytać o niego .
VERB+PRON	starając	starać	8	się	się	9	starając się	starać się	Ta antynomia uprzytamnia trudności , jakie znajdujemy , starając się zrekonstruować zamysł skryty w tradycji wielokulturowego pogranicza .
VERB+PRON	zdarzają	zdarzać	2	się	się	3	zdarzają się	zdarzać się	A przecież zdarzają się w rodzinach sytuacje kryzysowe - pogrzeb , pobyt w szpitalu , w takich momentach stajemy się bezradni .
VERB+PRON	stajemy	stawać	18	się	się	19	stajemy się	stawać się	A przecież zdarzają się w rodzinach sytuacje kryzysowe - pogrzeb , pobyt w szpitalu , w takich momentach stajemy się bezradni .
VERB+PRON	przyznaje	przyznawać	19	się	się	20	przyznaje się	przyznawać się	Karcę się , że powinnam powinna m wstać o szóstej , żeby wybrnąć ze wszystkiego co mam zaplanowane - przyznaje się .
NOUN+VERB	wyróżnienie	wyróżnienie	18	otrzymał	otrzymać	19	wyróżnienie otrzymał	wyróżnienie otrzymać	"Za najlepszą główną rolę męską ( w filmie Vladimira Michalka "" Trzeba zabić Sekala "" ) to prestiżowe wyróżnienie otrzymał Olaf Lubaszenko ."
VERB+NOUN	dawała	dawać	13	szansę	szansa	14	dawała szansę	dawać szansa	"Obowiązująca w czasie wyborów 1991 r . ordynacja "" bez progu "" każdemu dawała szansę ."
VERB+PRON	zawahał	zawahać	1	się	się	2	zawahał się	zawahać się	Chłopak zawahał się .
VERB+PRON	troszczą	troszczyć	13	się	się	14	troszczą się	troszczyć się	A czy skarby sprawiedliwie zdobyte , czy też z niegodziwości pochodzą , nie troszczą się one o to wcale - pomstował .
VERB+NOUN	spowodowała	spowodować	36	śmierć	śmierć	37	spowodowała śmierć	spowodować śmierć	Przedstawiciel Głównego Inspektoratu Sanitarnego Józef Knap zapowiedział wczoraj , że wkrótce rozpoczną się badania , które pozwolą stwierdzić , czy klebsiella pneumoniae , znaleziona w wymazach pobranych ze szpitala im . Madurowicza i ta , która spowodowała śmierć noworodków pochodzą z tego samego szczepu .
VERB+PRON	cieszą	cieszyć	5	się	się	6	cieszą się	cieszyć się	Zdaniem Elżbiety Wojciechowskiej , autobusy cieszą się sporym zainteresowaniem , często przyjeżdżają całkowicie zapełnione .
VERB+NOUN	oddał	oddać	1	hołd	hołd	2	oddał hołd	oddać hołd	Pułkownik oddał hołd polskim oficerom , którzy zginęli w ZSRR i w kraju , skazani w ludobójczych procesach .
VERB+NOUN	mieli	mieć	16	krzywdę	krzywda	17	mieli krzywdę	mieć krzywda	Wszystko można o ponurych czasach PRL-u powiedzieć , ale nie to , że za komuny sportowcy mieli krzywdę .
VERB+PRON	Da	dać	0	się	się	1	Da się	dać się	Da się w Polsce zarobić na boksie ?
ADJ+NOUN	mających	mieć	12	zastosowanie	zastosowanie	13	mających zastosowanie	mieć zastosowanie	Istotne jest , aby cele edukacji ekologicznej zostały przełożone na język konkretów mających zastosowanie w codziennych działaniach ucznia .
VERB+PRON	czuje	czuć	2	się	się	3	czuje się	czuć się	- On czuje się już na tyle mocny , że już nawet o własnych siłach poszedł do szkoły odebrać świadectwo - tata z radością obserwuje przemianę Wojtka .
VERB+ADP	oddać	oddać	10	do	do	11	oddać do	oddać do	Na przełomie czerwca i lipca Stomil - Olsztyn SA zamierza oddać do użytku budowany właśnie magazyn opon .
VERB+NOUN	składają	składać	18	życzenia	życzenie	19	składają życzenia	składać życzenie	Kto , gdzie i jaką komunię wyprawia , zależy od zasobności portfela , ale pod kościołem sąsiedzi też składają życzenia dzieciakom i dają im komunijne pamiątki .
VERB+NOUN	chlapie	chlapać	2	ozorem	ozór	3	chlapie ozorem	chlapać ozór	Niech nie chlapie ozorem , że jest taka stara , to nikt jej w bardziej czy mniej bezpośredni sposób wieku wypominał nie będzie .
PRON+VERB	się	się	2	dzieje	dziać	3	się dzieje	się dziać	Bardzo źle się dzieje , gdy coraz więcej kierowców siada za kółkiem po wypiciu alkoholu , jest zaś jeszcze gorzej , gdy to samo robią stróże porządku .
VERB+ADP	siada	siadać	9	za	za	10	siada za	siadać za	Bardzo źle się dzieje , gdy coraz więcej kierowców siada za kółkiem po wypiciu alkoholu , jest zaś jeszcze gorzej , gdy to samo robią stróże porządku .
VERB+PRON	przyznają	przyznawać	4	się	się	5	przyznają się	przyznawać się	Lekarz i taksówkarz nie przyznają się do winy .
VERB+PRON	staje	stawać	19	się	się	20	staje się	stawać się	Przecież te kilkaset głosów stanu Floryda nieubłaganie absolutyzuje się w świadomości światowej opinii publicznej w ten sposób , że staje się reprezentacją , a nawet częścią wszystkich amerykańskich głosów .
VERB+PRON	cieszyło	cieszyć	2	się	się	3	cieszyło się	cieszyć się	Niewielkim zainteresowaniem cieszyło się otwarcie Studia Festiwalowego w hangarze obok teatru .
VERB+PRON	Zlitujcie	zlitować	0	się	się	1	Zlitujcie się	zlitować się	Zlitujcie się nad sędziami .
ADJ+PRON	znajdujących	znajdować	12	się	się	13	znajdujących się	znajdować się	"15 okrętów należących do NATO oraz polski ORP "" Piast "" ewakuowało znajdujących się tam turystów ."
ADP+NOUN	w	w	4	stanie	stan	5	w stanie	w stan	Wiadukt nie był jednak w stanie wytrzymać obciążenia większego niż 30 ton .
VERB+NOUN	ponieść	ponieść	12	wydatki	wydatek	13	ponieść wydatki	ponieść wydatek	Zobowiązania potencjalne przekształcają się w realne wówczas , gdy skarb państwa musi ponieść wydatki na rzecz banków w przypadku niesolidnych podmiotów , którym udzielono poręczeń rządowych .
VERB+NOUN	udzielono	udzielić	23	poręczeń	poręczenie	24	udzielono poręczeń	udzielić poręczenie	Zobowiązania potencjalne przekształcają się w realne wówczas , gdy skarb państwa musi ponieść wydatki na rzecz banków w przypadku niesolidnych podmiotów , którym udzielono poręczeń rządowych .
VERB+PRON	zna	znać	8	się	się	9	zna się	znać się	A co do Vogtsa , to jednak nie zna się na piłce .
VERB+PRON	przejrzą	przejrzeć	6	się	się	7	przejrzą się	przejrzeć się	Córy moje , nim siądą , przejrzą się do lustra .
VERB+PRON	wykazały	wykazać	9	się	się	10	wykazały się	wykazać się	Ku zaskoczeniu Michała Targowskiego , dyrektora zoo , dzieci wykazały się olbrzymią wiedzą i bezbłędnie odpowiadały na pytania .
PRON+VERB	się	się	9	opłacają	opłacać	10	się opłacają	się opłacać	Na dalszą metę działania etyczne ( dobre ) zawsze się opłacają - powiada utylitarysta .
VERB+ADP	będzie	być	19	w	w	20	będzie w	być w	Być może Kwartet ( USA , ONZ , UE i Rosja ) z udziałem sił demokratycznych w społeczeństwie palestyńskim będzie w stanie to w części zrealizować .
SCONJ+VERB	jak	jak	6	przystało	przystać	7	jak przystało	jak przystać	W Düsseldorfie mają drugi dom – jak przystało na obywateli posługujących się dwoma paszportami : polskim i niemieckim .
ADJ+PRON	posługujących	posługiwać	10	się	się	11	posługujących się	posługiwać się	W Düsseldorfie mają drugi dom – jak przystało na obywateli posługujących się dwoma paszportami : polskim i niemieckim .
VERB+PRON	pojawił	pojawić	2	się	się	3	pojawił się	pojawić się	"La Vey pojawił się w filmie Romana Polańskiego "" Dziecko Rosemary "" ."
VERB+NOUN	staje	stawać	11	otworem	otwór	12	staje otworem	stawać otwór	A teraz - po czterdziestu latach zamknięcia dla zwiedzających - świątynia staje otworem , i to już nie w postaci ruin .
NOUN+PRON	wyprowadzeniu	wyprowadzić	13	się	się	14	wyprowadzeniu się	wyprowadzić się	U podstaw tej różnicy leży przede wszystkim fakt , że dom ten po wyprowadzeniu się Szymanowskiego był użytkowany jako budynek lokatorski , stąd też jego wnętrze w momencie przekazania go muzeum nie miało z kompozytorem wiele wspólnego .
NOUN+VERB	propozycje	propozycja	1	składają	składać	2	propozycje składają	propozycja składać	Najpierw propozycje składają same gwiazdy , dyskutują je z trenerami głosu , przedstawiają producentowi , producenci dyskutują ze sobą , potem ze stacją Polsat , potem z Radiem Zet , na końcu z Markiem Sierockim - czy Polak to kupi , czy nie .
VERB+PRON	stały	stać	2	się	się	3	stały się	stać się	Ostatnio plagą stały się kradzieże samochodów japońskich , które do tej pory nie cieszyły się wzięciem u złodziei .
VERB+PRON	cieszyły	cieszyć	13	się	się	14	cieszyły się	cieszyć się	Ostatnio plagą stały się kradzieże samochodów japońskich , które do tej pory nie cieszyły się wzięciem u złodziei .
PART+VERB	nie	nie	6	ma	mieć	7	nie ma	nie mieć	Bo na dobroduszność szpitala matka Kamila nie ma co liczyć .
VERB+PRON	powołując	powoływać	6	się	się	7	powołując się	powoływać się	Nieco wcześniej rzecznik odpowiedzialności zawodowej , powołując się na opinię biegłego , odmówił wszczęcia postępowania dyscyplinarnego wobec dr . Henryka Laskowskiego .
VERB+NOUN	przedstawiono	przedstawić	2	zarzut	zarzut	3	przedstawiono zarzut	przedstawić zarzut	33-letniemu mężczyźnie przedstawiono zarzut usiłowania zabójstwa ochroniarza .
VERB+PRON	Okazało	okazać	0	się	się	1	Okazało się	okazać się	Okazało się , że przez trzy dni balowała z moim najlepszym koleżką w Sopocie .
VERB+NOUN	przyjął	przyjąć	1	Komunię	komunia	2	przyjął Komunię	przyjąć komunia	Wojciech przyjął Komunię św .
VERB+NOUN	truł	truć	8	dupę	dupa	9	truł dupę	truć dupa	Stary pierdziel będzie tu przychodził co godzinę i truł dupę , jeszcze mi ślinił ręce , a idź , obrzydliwy jest , cuchnie mu z ryja czosnkiem , daj spokój , myślałam myślała m , że się zerzygam .
VERB+NOUN	daj	dać	28	spokój	spokój	29	daj spokój	dać spokój	Stary pierdziel będzie tu przychodził co godzinę i truł dupę , jeszcze mi ślinił ręce , a idź , obrzydliwy jest , cuchnie mu z ryja czosnkiem , daj spokój , myślałam myślała m , że się zerzygam .
PRON+VERB	się	się	36	zerzygam	zerzygam	37	się zerzygam	się zerzygam	Stary pierdziel będzie tu przychodził co godzinę i truł dupę , jeszcze mi ślinił ręce , a idź , obrzydliwy jest , cuchnie mu z ryja czosnkiem , daj spokój , myślałam myślała m , że się zerzygam .
VERB+PRON	rozsiadła	rozsiąść	1	się	się	2	rozsiadła się	rozsiąść się	Wieś rozsiadła się opodal traktu wiodącego prosto do Koszalina .
VERB+ADP	trzyma	trzymać	2	przy	przy	3	trzyma przy	trzymać przy	Co mnie trzyma przy życiu , to nadzieja , że wezmę odwet .
VERB+NOUN	wezmę	wziąć	10	odwet	odwet	11	wezmę odwet	wziąć odwet	Co mnie trzyma przy życiu , to nadzieja , że wezmę odwet .
VERB+PRON	dopatrzyła	dopatrzyć	21	się	się	22	dopatrzyła się	dopatrzyć się	Przewodniczący sejmowej komisji ds . specsłużb Konstanty Miodowicz ( AWS ) powiedział , że komisja wysoko oceniła działania WSI i nie dopatrzyła się większych uchybień .
VERB+PRON	posługujesz	posługiwać	23	się	się	24	posługujesz się	posługiwać się	"Scharakteryzuj je dokładnie "" oraz "" Opisz , jakimi mechanizmami obronnymi : a ) posługiwałeś posługiwał eś się pijąc alkohol , b ) posługujesz się teraz ( będąc tu w oddziale ) "" ."
ADJ+ADP	wyssane	wyssać	22	z	z	23	wyssane z	wyssać z	W tym pierwszym przypadku bardzo łatwo byłoby było by zdemaskować , że to o czym próbują powiedzieć jest sztuczne , nienaturalne , wyssane z szóstego palca ręki .
VERB+PRON	wywiązać	wywiązać	18	się	się	19	wywiązać się	wywiązać się	Czy jest badany również wątek taki , że pan Rywin mógł wziąć pieniądze od pana Michnika i nie wywiązać się z zadań i dlatego pan Michnik awanturuje się o to , że nie może nabyć w odpowiednim czasie telewizji Polsat .
VERB+PRON	awanturuje	awanturować	26	się	się	27	awanturuje się	awanturować się	Czy jest badany również wątek taki , że pan Rywin mógł wziąć pieniądze od pana Michnika i nie wywiązać się z zadań i dlatego pan Michnik awanturuje się o to , że nie może nabyć w odpowiednim czasie telewizji Polsat .
PRON+VERB	się	się	8	podziać	podziać	9	się podziać	się podziać	- Mamy duży ogród , więc mamy gdzie się podziać .
VERB+NOUN	dać	dać	3	czas	czas	4	dać czas	dać czas	Jego członkowie chcą dać czas politykom na osiągnięcie porozumienia .
VERB+PRON	Podpisuję	podpisywać	0	się	się	1	Podpisuję się	podpisywać się	Podpisuję się pod tym .
VERB+PRON	staje	stawać	1	się	się	2	staje się	stawać się	Konieczne staje się w związku z tym rozszerzenie uprawnień samorządów mieszkańców , w których to samorządach udział kobiet będzie miał nieocenione znaczenie .
VERB+NOUN	daje	dawać	8	wiary	wiara	9	daje wiary	dawać wiara	Zaleski , jako jeden z nielicznych , nie daje wiary rzekomej “ warsztatowej nieporadności ” Kane .
VERB+PRON	odniosło	odnieść	21	się	się	22	odniosło się	odnieść się	Sądzę , że ta bieda połączy raczej kapłanów wojsk natowskich z naszymi we wspólnych zabiegach , aby kierownictwo polskiego resortu wojskowego odniosło się bardziej łaskawie do potrzeb materialnych duszpasterstwa .
VERB+NOUN	spowodowały	spowodować	6	podniesienie	podnieść	7	spowodowały podniesienie	spowodować podnieść	We wtorek koło Kukułowa silne wiatry spowodowały podniesienie stanu wody na Dziwnie , która zerwała drogę .
VERB+PRON	zaciągnął	zaciągnąć	13	się	się	14	zaciągnął się	zaciągnąć się	Doktor Kamiński podał podporucznikowi Ziembie zapalonego papierosa , wziął go mokrymi palcami , zaciągnął się łapczywie i zakaszlał .
NOUN+NOUN	zapewnienia	zapewnić	6	czystości	czystość	7	zapewnienia czystości	zapewnić czystość	- Do właścicieli nieruchomości należy obowiązek zapewnienia czystości i porządku na ich terenie .
VERB+PRON	zgodziła	zgodzić	3	się	się	4	zgodziła się	zgodzić się	Większość państw Dwunastki zgodziła się , ale Francja i Hiszpania postawiły weto .
VERB+NOUN	postawiły	postawić	10	weto	weto	11	postawiły weto	postawić weto	Większość państw Dwunastki zgodziła się , ale Francja i Hiszpania postawiły weto .
VERB+PRON	przyglądały	przyglądać	1	się	się	2	przyglądały się	przyglądać się	Akcji przyglądały się władze powiatu i gminy .
VERB+PRON	przedostała	przedostać	19	się	się	20	przedostała się	przedostać się	Dokonawszy tego dzieła , uznali wyspę za swoją własność i postanowili pilnować , żeby wiadomość o jej istnieniu nie przedostała się do obcych .
ADP+PROPN	Z	z	0	nieba	niebo	1	Z nieba	z niebo	Z nieba leje się żar .
VERB+PRON	leje	lać	2	się	się	3	leje się	lać się	Z nieba leje się żar .
VERB+PRON	zdecydował	zdecydować	10	się	się	11	zdecydował się	zdecydować się	"Z kolei telewizyjne "" Wiadomości "" podały , że Dziurowicz zdecydował się kandydować ."
VERB+PRON	zastanawiając	zastanawiać	50	się	się	51	zastanawiając się	zastanawiać się	Zabawne , że tak mało osób zauważa niesamowity paradoks , który nikogo nie zdumiewa : rządząca partia PiS robi wszystko , aby Sejm nie uchwalił przygotowanego przez jej rząd budżetu , zaś opozycja zbiera siły i jednoczy się , aby na złość rządowi ten rządowy budżet jak najszybciej uchwalić nie zastanawiając się nawet nad jego zawartością .
PRON+VERB	się	się	2	stało	stać	3	się stało	się stać	Aby tak się stało , potrzebna jest współpraca trzech województw .
VERB+PRON	oddajesz	oddawać	4	się	się	5	oddajesz się	oddawać się	Najlepiej jak umiesz , oddajesz się licznym i trochę nudnym obowiązkom , jakie nakłada na ciebie ta sytuacja , ale czasem czujesz się zmęczona swą rolą .
VERB+PRON	czujesz	czuć	21	się	się	22	czujesz się	czuć się	Najlepiej jak umiesz , oddajesz się licznym i trochę nudnym obowiązkom , jakie nakłada na ciebie ta sytuacja , ale czasem czujesz się zmęczona swą rolą .
VERB+PRON	bawiła	bawić	11	się	się	12	bawiła się	bawić się	Sejmowa Komisja do spraw UE w sile 30 posłów trzy dni bawiła się na wyjeździe .
VERB+NOUN	Zadaje	zadawać	0	pytania	pytanie	1	Zadaje pytania	zadawać pytanie	Zadaje pytania dotyczące polityki , moralności , religii i sam na nie odpowiada .
ADP+PRON	w	w	19	co	co	20	w co	w co	W pracy od czasu pójścia Magdy na urlop macierzyński było tyle roboty , że nie wiedziałam wiedziała m , w co ręce włożyć .
NOUN+VERB	ręce	ręka	21	włożyć	włożyć	22	ręce włożyć	ręka włożyć	W pracy od czasu pójścia Magdy na urlop macierzyński było tyle roboty , że nie wiedziałam wiedziała m , w co ręce włożyć .
NOUN+VERB	działania	działanie	5	podjął	podjąć	6	działania podjął	działanie podjąć	Następne pytanie : - Jakie działania podjął urząd prezydenta w sprawie konfliktu na Białorusi ?
PRON+VERB	się	się	1	wstydzę	wstydzić	2	się wstydzę	się wstydzić	Bardzo się wstydzę .
VERB+NOUN	stosować	stosować	10	terapię	terapia	11	stosować terapię	stosować terapia	Wrocławska klinika Akademii Medycznej jako pierwsza w Polsce zacznie niedługo stosować terapię genową .
VERB+PRON	podlizywał	podlizywać	16	się	się	17	podlizywał się	podlizywać się	- Ale wysoki ten nasz prezydent , wiadomo że ludzie o szerokich horyzontach są wysocy - podlizywał się swojemu pryncypałowi opuszczając mikrofon prowadzący imprezę Krzysztof Kopacki , dyrektor Książnicy Stargardzkiej .
ADJ+PRON	pojawiających	pojawiać	14	się	się	15	pojawiających się	pojawiać się	Uwagi krytyczne dotyczyły też stylu kampanii , a także sporów personalnych w partii , pojawiających się w miejsce programowych .
VERB+NOUN	ma	mieć	5	ochotę	ochota	6	ma ochotę	mieć ochota	Dyrygent pyta Wdowę , czy ma ochotę na polską zupę , na polski rosół , z koguta , jak już nie ma kury , bo z kury lepszy , wiadomo , bo nie tak tłusty , a z koguta , wiadomo , tłusty , ale lepszy taki niż w ogóle żaden .
PRON+VERB	się	się	35	cieszyć	cieszyć	36	się cieszyć	się cieszyć	Tak przykra zmiana kolorytu emocjonalnego , jaką się przeżywa w depresji , uświadamia choremu , jak niepewny jest jego obraz świata , oraz że w ciemności depresji świat wygląda zupełnie inaczej i tym bardziej trzeba się cieszyć , gdy z powrotem świat się rozjaśni .
