type	first_word	first_word_lemma	first_word_id	second_word	second_word_lemma	second_word_id	full_mwe	full_mwe_lemma	sentence
VERB+NOUN	prowadzi	prowadzić	2	zajęcia	zajęcia	3	prowadzi zajęcia	prowadzić zajęcia	Jeżeli asystent prowadzi zajęcia z 300 studentami , ma przygotować się do zajęć , pisać doktorat , a oprócz tego gdzieś zarabiać - czas , kóry może poświęcić na sprawdzanie i omawianie kolokwiów , prac pisemnych oraz konsultacje indywidualne , to mniej niż godzina rocznie na studenta .
VERB+PRON	okazało	okazać	10	się	się	11	okazało się	okazać się	"W dodatku , gdy zaczęto oczyszczać go z mułu , okazało się , że na kamieniu wyryty jest napis : "" Zmiłuj się , jeżeli masz serce ludzkie , i obróć mnie ! """
ADP+NOUN	do	do	22	dymisji	dymisja	23	do dymisji	do dymisja	"Po prof . Stanisławie Okularczyku to kolejny zastępca ministra Jurgiela żegnający się z resortem , a według "" Gazety Wyborczej "" , do dymisji chce podać się także prof . Andrzej Kowalski ."
NOUN+NOUN	zapewnienie	zapewnić	9	przepływu	przepływ	10	zapewnienie przepływu	zapewnić przepływ	Dlatego głównym , niejako pierwotnym celem polityki integracyjnej było zapewnienie przepływu towarów , usług , siły roboczej , możliwość zakładania filii , zapewnienie konkurencyjności i braku dyskryminacji w działalności gospodarczej .
NOUN+NOUN	zapewnienie	zapewnić	22	konkurencyjności	konkurencyjność	23	zapewnienie konkurencyjności	zapewnić konkurencyjność	Dlatego głównym , niejako pierwotnym celem polityki integracyjnej było zapewnienie przepływu towarów , usług , siły roboczej , możliwość zakładania filii , zapewnienie konkurencyjności i braku dyskryminacji w działalności gospodarczej .
VERB+PRON	zajmuje	zajmować	24	się	się	25	zajmuje się	zajmować się	Wszystkie akcje należą do prezydenta i dyrektora technicznego Mario Rapanelli oraz jego brata Ezia ( dyrektor handlowy ) ; syn Ezia , Paolo , zajmuje się rynkami zagranicznymi .
VERB+NOUN	pełnił	pełnić	18	funkcję	funkcja	19	pełnił funkcję	pełnić funkcja	Wśród nich jest sześciu , którzy reprezentowali nasz klub - wyjaśnił Marian Kaluska , który do tej pory pełnił funkcję prezesa Kanału .
NOUN+NOUN	prowadzenie	prowadzić	12	rozmów	rozmowa	13	prowadzenie rozmów	prowadzić rozmowa	Po sezonie 1998 skończy się bowiem kontrakt Piotrowi Protasiewiczowi , zaś jednoczesne prowadzenie rozmów z trzema liderami na pewno przekroczyło by wówczas finansowe możliwości klubu .
VERB+NOUN	osiągać	osiągać	11	sukcesy	sukces	12	osiągać sukcesy	osiągać sukces	Otylia jest lokomotywą polskiego pływania , pierwsza pokazała , że można osiągać sukcesy .
ADP+NOUN	na	na	20	stanowisko	stanowisko	21	na stanowisko	na stanowisko	Młodszy insp . Cezary Jamrozik , główny księgowy Komendy Wojewódzkiej Policji w Łodzi , został powołany przez komendanta głównego policji na stanowisko zastępcy dyrektora Biura Finansów Komendy Głównej Policji .
ADP+PROPN	od	od	4	zera	zero	5	od zera	od zero	- Znów zaczynali śmy od zera - mówi Seth Tuckerman , do niedawna zastępca prezesa europejskiego oddziału Gerbera .
VERB+PRON	załatwił	załatwić	4	się	się	5	załatwił się	załatwić się	Kilka dni temu ktoś załatwił się pod ich oknem .
VERB+PART	Chcąc	chcieć	0	nie	nie	1	Chcąc nie	chcieć nie	Chcąc nie chcąc , podjął się jednak leczenia w przychodni , mimo że specjalista uznał to za zbyt ryzykowne .
VERB+PRON	podjął	podjąć	4	się	się	5	podjął się	podjąć się	Chcąc nie chcąc , podjął się jednak leczenia w przychodni , mimo że specjalista uznał to za zbyt ryzykowne .
VERB+PRON	wybrali	wybrać	7	się	się	8	wybrali się	wybrać się	Na pokładzie było 109 pasażerów , którzy wybrali się w rejs z wolnocłowymi zakupami .
VERB+PRON	stara	starać	1	się	się	2	stara się	starać się	Rada stara się stworzyć lobby środowiskowe , które pomoże w uzdrowieniu sytuacji .
VERB+NOUN	zwraca	zwracać	20	uwagę	uwaga	21	zwraca uwagę	zwracać uwaga	- Wszystkie stanowiska wyposażone są w nagrywarki i odtwarzacze DVD , co czyni z nich w pełni multimedialne konsole - zwraca uwagę Ireneusz Pieczyk .
VERB+PRON	chwali	chwalić	27	się	się	28	chwali się	chwalić się	- A jeszcze wcześniej , bo w 2007 roku , policjanci z Cieszyna uczyli się języka czeskiego , zaś ci z jednostki w Żywcu - słowackiego - chwali się kom . Wójciak .
VERB+PRON	Zrobił	zrobić	0	się	się	1	Zrobił się	zrobić się	Zrobił się jakby lekko zadarty . . .
VERB+PRON	świeci	świecić	1	się	się	2	świeci się	świecić się	Nie świeci się również wiele lamp - tłumaczył Zygmunt Wichta .
VERB+PRON	udało	udać	1	się	się	2	udało się	udać się	Nie udało się .
VERB+NOUN	przynosić	przynosić	12	zyski	zysk	13	przynosić zyski	przynosić zysk	Poczta zmniejsza swój deficyt i już w 1997 r . powinna zacząć przynosić zyski .
VERB+PRON	staram	starać	1	się	się	2	staram się	starać się	"Ja staram się tylko zobrazować to , że same ubooty , choćby nie wiem jak doskonałe , potrzebują wsparcia , a to zapewniały im i te "" maluchy nawodne "" i te kolosy ."
NOUN+VERB	podpisów	podpis	2	złożono	złożyć	3	podpisów złożono	podpis złożyć	Niemal tysiąc podpisów złożono pod zamieszczoną w Internecie petycją w obronie barów mlecznych .
PART+VERB	nie	nie	1	ma	mieć	2	nie ma	nie mieć	Dlatego nie ma co deliberować o tym , jak to będzie za tydzień , czy za kilka miesięcy .
VERB+PRON	powołując	powoływać	5	się	się	6	powołując się	powoływać się	"W 1950 roku Sejm , powołując się na tezę Lenina ( "" Komunizm to władza rad . . . "" ) , przyjął ustawę o powszechnej elektryfikacji , która obowiązuje do dzisiaj ."
VERB+PRON	znęcać	znęcać	4	się	się	5	znęcać się	znęcać się	Iwona R . zaczęła znęcać się nad mężem psychicznie i fizycznie już w 3 miesiące po ślubie , a niespełna rok później wyrzuciła go z jego mieszkania , które otrzymał po babci i zamieszkała tam z kochankiem .
VERB+PRON	pojawia	pojawiać	11	się	się	12	pojawia się	pojawiać się	Szczęściem w perspektywie historycznej nazwałbym nazwał by m okres , kiedy pojawia się przed szerszymi społecznościami , narodami , grupami zawodowymi , zbiorowiskami sąsiadów , rodzinami nadzieja na ziszczenie celów , do jakich się dąży i to nie w sposób egoistyczny .
VERB+PRON	domagając	domagać	7	się	się	8	domagając się	domagać się	Radni poruszyli problem złych nawierzchni dróg , domagając się ich remontu .
VERB+PRON	interesują	interesować	6	się	się	7	interesują się	interesować się	Jak twierdzi Ryszard Bohiński , hipnozą interesują się ludzie , którzy chcą pomagać , a nie szkodzić .
VERB+PRON	przymierzają	przymierzać	11	się	się	12	przymierzają się	przymierzać się	Dobrze wróży na przyszłość również i to , że do partnerstwa przymierzają się kolejne banki i towarzystwa zarówno majątkowe , jak i życiowe .
VERB+PRON	przestraszyły	przestraszyć	1	się	się	2	przestraszyły się	przestraszyć się	Panie przestraszyły się i zdenerwowały , ale nie straciły zimnej krwi .
VERB+ADJ	straciły	stracić	8	zimnej	zimny	9	straciły zimnej	stracić zimny	Panie przestraszyły się i zdenerwowały , ale nie straciły zimnej krwi .
NOUN+NOUN	słowo	słowo	17	honoru	honor	18	słowo honoru	słowo honor	Kiedy wszyscy zamarli z ciekawości , zagrzmiał swym basem : - No więc daję wam na to słowo honoru !
VERB+PRON	udało	udać	3	się	się	4	udało się	udać się	Biologom z Białowieży udało się go uwolnić , nie wiadomo , czy zwierzę przeżyje .
VERB+NOUN	rzucił	rzucić	4	okiem	oko	5	rzucił okiem	rzucić oko	"Janek poderwał się , rzucił okiem na nazwę stacji : "" Św . Martin "" ."
ADP+NOUN	do	do	4	zakupu	zakup	5	do zakupu	do zakup	Nowa ustawa zobowiąże szefów do zakupu okularów korekcyjnych dla pracowników , którzy potrzebują ich podczas wykonywania swoich zajęć .
VERB+NOUN	dokonać	dokonać	13	odprawy	odprawa	14	dokonać odprawy	dokonać odprawa	Jednak grecka policja imigracyjna zabroniła Polakom powrotu do kraju , gdyż nie mogli dokonać odprawy paszportowo - celnej .
VERB+PRON	zajmowali	zajmować	17	się	się	18	zajmowali się	zajmować się	"Nowy prezes zarzucił dziennikarzom "" Wiadomości "" brak profesjonalizmu i zganił za to , że zbyt często zajmowali się nieistotnymi sporami politycznymi , zamiast informować o wzroście płac , rekordowych wzrostach produkcji i spadku bezrobocia ."
VERB+NOUN	mam	mieć	3	nadzieję	nadzieja	4	mam nadzieję	mieć nadzieja	– Ja też mam nadzieję , że się dobrze bawicie .
VERB+PRON	wpatrują	wpatrywać	17	się	się	18	wpatrują się	wpatrywać się	Bywa , że dwaj przeciwnicy nagle nieruchomieją , stojąc na wyprostowanych łapach , z nadętymi podgardlami , wpatrują się wzajemnie w siebie i gwałtownie kiwają głowami .
VERB+PRON	imała	imać	1	się	się	2	imała się	imać się	Nie imała się ich rdza .
VERB+PRON	boję	bać	2	się	się	3	boję się	bać się	- Nie boję się .
VERB+PRON	poruszają	poruszać	5	się	się	6	poruszają się	poruszać się	We wszystkich tych przypadkach nukleony poruszają się całą grupą , przejawiają zatem zachowanie kolektywne , takie właśnie jak cząsteczki cieczy - płyną całą gromadą .
VERB+PRON	wygramolił	wygramolić	1	się	się	2	wygramolił się	wygramolić się	Dulda wygramolił się na północny , pokryty białymi kaflami brzeg sadzawki , wypróżnił komory nosowe gestem sygnalizowanego obrzydzenia i udał się pod natrysk , żeby spłukać zarazki , jakie mogły podczas uprawiania sportu pokryć jego delikatne ciało .
VERB+PRON	udał	udać	19	się	się	20	udał się	udać się	Dulda wygramolił się na północny , pokryty białymi kaflami brzeg sadzawki , wypróżnił komory nosowe gestem sygnalizowanego obrzydzenia i udał się pod natrysk , żeby spłukać zarazki , jakie mogły podczas uprawiania sportu pokryć jego delikatne ciało .
VERB+NOUN	da	dać	3	skrzydła	skrzydło	4	da skrzydła	dać skrzydło	A co nam da skrzydła ? - pozytywny , choć nie bezkrytyczny stosunek do PRL , zakończenie wojen o przeszłość , czytelny program własny , a więc aksjologia , ideały i wartości .
VERB+PRON	znajdą	znaleźć	23	się	się	24	znajdą się	znaleźć się	"Dodał , że rozmawiał z Bukowskim o sposobach "" rozliczenia z przeszłością "" , czemu służyć mają m.in . materiały archiwalne , które znajdą się w Instytucie Pamięci Narodowej ."
VERB+NOUN	dokonał	dokonać	41	rozboju	rozbój	42	dokonał rozboju	dokonać rozbój	11 lutego Sąd Rejonowy w Tczewie zastosował środek zapobiegawczy w postaci tymczasowego aresztowania na okres trzech miesięcy wobec 18-letniego mieszkańca gm . Tczew podejrzanego o to , że 8 lutego br . w Tczewie , działając wspólnie z nieletnim tczewianinem , dokonał rozboju na mieszkance Tczewa .
VERB+NOUN	przyznali	przyznać	6	kredyty	kredyt	7	przyznali kredyty	przyznać kredyt	W końcu wymyślili : lekką ręką przyznali kredyty żniwne .
NOUN+NOUN	składanie	składać	11	obietnic	obietnica	12	składanie obietnic	składać obietnica	Chaotyczny , pozbawiony planu tryb życia , liczne nieprzemyślane wydatki , składanie obietnic bez pokrycia - to też są pozostałości z poprzedniej epoki .
VERB+PRON	zapowiada	zapowiadać	11	się	się	12	zapowiada się	zapowiadać się	Dzisiejsza konfrontacja z łódzkimi zespołami , które mają pierwszoligowe aspiracje , zapowiada się niezwykle ciekawie .
VERB+PRON	znaleźli	znaleźć	3	się	się	4	znaleźli się	znaleźć się	Po godzinie wałęsania znaleźli się wśród wąskich uliczek starego miasta .
PRON+VERB	się	się	8	porozumieć	porozumieć	9	się porozumieć	się porozumieć	W piątek koalicja AWS i UW nie zdołały się porozumieć w sprawie wspólnego kandydata .
NOUN+PROPN	wykonanie	wykonać	6	zadania	zadanie	7	wykonanie zadania	wykonać zadanie	""" Melduję , panie prezesie , wykonanie zadania "" - to trwały wkład w demokrację i ponadpartyjność urzędu prezydenckiego ."
VERB+ADP	dają	dawać	3	za	za	4	dają za	dawać za	Polscy producenci nie dają za wygraną , dotrzymując kroku modzie i zachodnim nowinkom .
VERB+NOUN	dotrzymując	dotrzymywać	7	kroku	krok	8	dotrzymując kroku	dotrzymywać krok	Polscy producenci nie dają za wygraną , dotrzymując kroku modzie i zachodnim nowinkom .
VERB+PRON	dogadać	dogadać	1	się	się	2	dogadać się	dogadać się	Potrafi dogadać się prawie z każdym .
PRON+VERB	się	się	1	raduje	radować	2	się raduje	się radować	Niech się raduje – myślałem myślał em , szybko wycofując się do furtki .
NOUN+NOUN	pełnienia	pełnić	16	obowiązków	obowiązek	17	pełnienia obowiązków	pełnić obowiązek	"19 dziennikarzy , o 7 mniej niż w 1997 roku , zginęło w roku 1998 podczas pełnienia obowiązków służbowych - podała w czwartek organizacja "" Reporterzy bez Granic "" ."
VERB+PRON	wydaje	wydawać	4	się	się	5	wydaje się	wydawać się	Dzięki tej podstawowej lekcji wydaje się tym bardziej prawdopodobne , że to demokracja - a nie komunizm - będzie siłą dominującą w dwudziestym pierwszym wieku .
VERB+PRON	stała	stać	24	się	się	25	stała się	stać się	"18 lipca prezydent depeszował do Ignacego Paderewskiego , że w związku z memoriałem Sikorskiego z 19 czerwca współpraca z dotychczasowym prezesem Rady Ministrów "" stała się niemożliwa "" ."
VERB+PRON	Upiera	upierać	5	się	się	6	Upiera się	upierać się	Prezes spytał szeptem : - Upiera się ?
VERB+PRON	okazać	okazać	13	się	się	14	okazać się	okazać się	W 1993 roku , jeżeli zostanie utrzymana dyscyplina finansowa , prognoza CUP może okazać się realna .
VERB+NOUN	udzielał	udzielać	14	chrztu	chrzt	15	udzielał chrztu	udzielać chrzt	Pod ochroną 30 wojów przybyli najpierw Wisłą do Gdańska , gdzie Wojciech nauczał i udzielał chrztu .
VERB+PRON	przyda	przydać	12	się	się	13	przyda się	przydać się	Odpowiedziała bez namysłu : – Jeśli to dla pana coś odkrywczego i przyda się panu do czegoś , będę szczęśliwa , że mogłam mogła m panu podsunąć tę myśl , a zaręczam , że to działa .
VERB+PRON	troszczyć	troszczyć	2	się	się	3	troszczyć się	troszczyć się	Kto powinien troszczyć się o stan chodników w mieście ?
VERB+PRON	udało	udać	3	się	się	4	udało się	udać się	Do wczoraj nie udało się uwolnić 16 pracowników klubu piłkarskiego FC Kauczuk Opava , których woda zmusiła do pozostania w budynkach stadionu .
VERB+PRON	domagał	domagać	15	się	się	16	domagał się	domagać się	Nawet mój kot Iwan , kiedy bawił em się z nim papierkiem na nitce , domagał się utrudnień .
VERB+PRON	rozdarł	rozedrzeć	4	się	się	5	rozdarł się	rozedrzeć się	Degraduję cię ! - rozdarł się zwykle łagodny Jasio .
VERB+PRON	uda	udać	12	się	się	13	uda się	udać się	Porażka rzeczywiście zaburza mi plan , ale winni temu , że nie uda się go wykonać , jesteśmy my .
VERB+ADP	stoi	stać	4	pod	pod	5	stoi pod	stać pod	Rozwój najtańszych marek również stoi pod znakiem zapytania .
NOUN+PROPN	znakiem	znak	6	zapytania	zapytanie	7	znakiem zapytania	znak zapytanie	Rozwój najtańszych marek również stoi pod znakiem zapytania .
ADJ+PRON	znajdujących	znajdować	8	się	się	9	znajdujących się	znajdować się	Ich kształt będzie nawiązaniem do historycznych fortów , znajdujących się w tym rejonie miasta .
VERB+PRON	pojawi	pojawić	18	się	się	19	pojawi się	pojawić się	Np . po każdych trzech kęsach odkładaj sztućce na bok i policz do pięciu - po 20 minutach pojawi się uczucie sytości .
VERB+PRON	waha	wahać	2	się	się	3	waha się	wahać się	Na razie waha się między 35 a 95 procent .
VERB+PRON	stały	stać	22	się	się	23	stały się	stać się	Jak niegdyś Grecja , stary ośrodek cywilizacji zachodniej zmarniał w jałowych zmaganiach swej wojny peloponeskiej , i źródłem nowych pomysłów i formuł stały się jego peryferie .
VERB+ADP	przyjdzie	przyjść	22	do	do	23	przyjdzie do	przyjść do	"Metoda ta polega na dokańczaniu zaczętych zdań lub odpowiadaniu na pytania bez użycia intelektu , "" pierwszą lepszą "" myślą , która przyjdzie do głowy , np . Jestem zły , bo . . . ( odpowiedź ze sfery podświadomej ) drażni mnie zachowanie niektórych ludzi ."
VERB+NOUN	mieli	mieć	7	okazję	okazja	8	mieli okazję	mieć okazja	Po przerwie przeważali gospodarze , którzy trzykrotnie mieli okazję na podwyższenie wyniku .
VERB+PRON	zrobiło	zrobić	5	się	się	6	zrobiło się	zrobić się	Wczoraj przy polskiej ambasadzie znowu zrobiło się gorąco .
PART+VERB	nie	nie	4	wymyśli	wymyślić	5	nie wymyśli	nie wymyślić	Grass prochu już raczej nie wymyśli , ale po Glińskim można się spodziewać lepszego filmu niż „ Wróżby kumaka ” .
PRON+VERB	się	się	11	spodziewać	spodziewać	12	się spodziewać	się spodziewać	Grass prochu już raczej nie wymyśli , ale po Glińskim można się spodziewać lepszego filmu niż „ Wróżby kumaka ” .
NOUN+ADJ	Ankieta	ankieta	0	przeprowadzona	przeprowadzić	1	Ankieta przeprowadzona	ankieta przeprowadzić	Ankieta przeprowadzona przez sieć telewizyjną Fox zapowiada , że książka Moniki Lewinsky o jej stosunkach seksualnych z prezydentem Billem Clintonem ( w marcu pojawi się na rynku ) prawie zupełnie nie interesuje Amerykanów .
VERB+PRON	pojawi	pojawić	23	się	się	24	pojawi się	pojawić się	Ankieta przeprowadzona przez sieć telewizyjną Fox zapowiada , że książka Moniki Lewinsky o jej stosunkach seksualnych z prezydentem Billem Clintonem ( w marcu pojawi się na rynku ) prawie zupełnie nie interesuje Amerykanów .
PRON+VERB	się	się	2	starał	starać	3	się starał	się starać	- Będę się starał o więcej - ripostuje Lepper , ale o konkretach nie mówi .
VERB+PRON	pojawił	pojawić	2	się	się	3	pojawił się	pojawić się	"Przepiękny problem pojawił się w "" Gazecie "" i został niestety spartolony ."
VERB+PRON	wydarł	wydrzeć	18	się	się	19	wydarł się	wydrzeć się	- No właśnie , łatwiej ! - zatriumfowała moja siostra , a Julek odciągnięty od gąsiorowego korka , wydarł się wniebogłosy .
VERB+PRON	zgodził	zgodzić	4	się	się	5	zgodził się	zgodzić się	Z jego decyzją nie zgodził się dyrektor szpitala , który odwołał się do Naczelnej Izby Lekarskiej w Warszawie .
VERB+PRON	odwołał	odwołać	10	się	się	11	odwołał się	odwołać się	Z jego decyzją nie zgodził się dyrektor szpitala , który odwołał się do Naczelnej Izby Lekarskiej w Warszawie .
ADP+NOUN	na	na	17	konto	konto	18	na konto	na konto	W dziewiątej rundzie Gołota znów przyśpieszył i sędziowie , chyba bez większych oporów , mogli zapisać ją na konto polskiego pięściarza .
PRON+VERB	się	się	6	liczy	liczyć	7	się liczy	się liczyć	CKM : Wobec tego , co się liczy ?
ADP+NOUN	na	na	2	końcu	koniec	3	na końcu	na koniec	Miał już na końcu jeżyka pytanie , ile waży Diglator , ale nie chcąc się blamować ignorancją , wziął latarkę od Gossego i ruszył wzdłuż stopy olbrzyma .
NOUN+NOUN	jeżyka	język	4	pytanie	pytanie	5	jeżyka pytanie	język pytanie	Miał już na końcu jeżyka pytanie , ile waży Diglator , ale nie chcąc się blamować ignorancją , wziął latarkę od Gossego i ruszył wzdłuż stopy olbrzyma .
PRON+VERB	się	się	14	blamować	blamować	15	się blamować	się blamować	Miał już na końcu jeżyka pytanie , ile waży Diglator , ale nie chcąc się blamować ignorancją , wziął latarkę od Gossego i ruszył wzdłuż stopy olbrzyma .
VERB+PRON	nadaje	nadawać	19	się	się	20	nadaje się	nadawać się	Wtedy opiekun tych studni , Zarząd Gospodarki Komunalnej chloruje wodę , a my ponownie badamy , czy tym razem nadaje się już do picia .
VERB+PRON	stać	stać	6	się	się	7	stać się	stać się	Dzięki temu moglibyśmy mogli by śmy stać się jej członkiem jeszcze przed końcem wieku .
VERB+PRON	udało	udać	1	się	się	2	udało się	udać się	Policji udało się już w dużym stopniu zrekonstruować przebieg wypadków .
VERB+PRON	trafił	trafić	9	się	się	10	trafił się	trafić się	KAROLINA : ( żartem ) Bogu dzięki , że trafił się ten ślub Kasi i Łukasza .
VERB+NOUN	mieć	mieć	3	zaufanie	zaufanie	4	mieć zaufanie	mieć zaufanie	- Skąd mogę mieć zaufanie ?
PRON+VERB	się	się	6	obywać	obywać	7	się obywać	się obywać	"Dopóki mamy niewysoką oglądalność , możemy się obywać bez presji i nacisków z różnych stron , które tak dobrze znam z telewizji publicznej - dodaje Hanna Smoktunowicz , prowadząca i wydawca "" Dziennika "" ."
VERB+PRON	udało	udać	4	się	się	5	udało się	udać się	Czy Marcie - matce udało się w pełni wywiązać z rodzicielskich powinności ?
NOUN+NOUN	zaciągania	zaciągać	9	zobowiązań	zobowiązanie	10	zaciągania zobowiązań	zaciągać zobowiązanie	5 . Upoważnia się Zarząd Gminy Wąbrzeźno do samodzielnego zaciągania zobowiązań finansowych nie przekraczających kwoty : 70.000,00 .
VERB+PRON	rozpycha	rozpychać	2	się	się	3	rozpycha się	rozpychać się	W Indiach rozpycha się dziś żarłoczny kapitalizm , a na politycznej scenie pojawiają się partie odwołujące się do religijnego i narodowego fanatyzmu .
VERB+PRON	pojawiają	pojawiać	12	się	się	13	pojawiają się	pojawiać się	W Indiach rozpycha się dziś żarłoczny kapitalizm , a na politycznej scenie pojawiają się partie odwołujące się do religijnego i narodowego fanatyzmu .
ADJ+PRON	odwołujące	odwoływać	15	się	się	16	odwołujące się	odwoływać się	W Indiach rozpycha się dziś żarłoczny kapitalizm , a na politycznej scenie pojawiają się partie odwołujące się do religijnego i narodowego fanatyzmu .
VERB+NOUN	Ma	mieć	0	obowiązek	obowiązek	1	Ma obowiązek	mieć obowiązek	Ma obowiązek objawić rzeczywistość swoją i rzeczywistość swojego otoczenia , to znaczy tę , która wpływała na kształtowanie jego rzeczywistości , w tym wypadku mam na myśli naród - kończy Vilbert recytując to z powagą niby werset Pisma świętego w Wielki Piątek .
VERB+ADP	mam	mieć	24	na	na	25	mam na	mieć na	Ma obowiązek objawić rzeczywistość swoją i rzeczywistość swojego otoczenia , to znaczy tę , która wpływała na kształtowanie jego rzeczywistości , w tym wypadku mam na myśli naród - kończy Vilbert recytując to z powagą niby werset Pisma świętego w Wielki Piątek .
VERB+NOUN	miały	mieć	10	miejsce	miejsce	11	miały miejsce	mieć miejsce	Nie sposób jednak nie zapytać , gdzie wtedy , gdy miały miejsce opisywane zdarzenia , byli członkowie zarządu PZU ?
VERB+PRON	wyobrazić	wyobrazić	1	sobie	siebie	2	wyobrazić sobie	wyobrazić siebie	Aby wyobrazić sobie , jak wygląda Mars w obiektywie dużego teleskopu przy powiększeniu 300 , należy oddalić zamieszczony rysunek jego tarczy o około 2 metry i patrzeć tylko jednym okiem , gdyż - w przeciwieństwie do lornetki - większość teleskopów astronomicznych posiada tylko jeden okular .
VERB+PRON	należy	należeć	1	się	się	2	należy się	należeć się	Wózek należy się raz na pięć lat .
PRON+VERB	się	się	15	spiknął	spiknąć	16	się spiknął	się spiknąć	Po prostu wyniknął problem . . . chcę jego kontakty zbadać , z kim on się spiknął , taki jest drugi , przez tą kurwę współpracownicę Gongadzego . . .
VERB+PRON	wyłania	wyłaniać	17	się	się	18	wyłania się	wyłaniać się	Były partyzancki dowódca Xanana Gusmao został triumfalnie wybrany na prezydenta Timoru Wschodniego , nowego państwa , które wyłania się z ruin i biedy na obszarze , należącym jeszcze trzy lata temu nieformalnie do Indonezji .
VERB+NOUN	ponosić	ponosić	9	odpowiedzialności	odpowiedzialność	10	ponosić odpowiedzialności	ponosić odpowiedzialność	Przyznał jednak , że niektóre firmy rzeczywiście nie chcą ponosić odpowiedzialności za zatrudnianie robotników przymusowych .
VERB+PRON	powiedzie	powieść	2	się	się	3	powiedzie się	powieść się	"Jeśli eksperyment powiedzie się , nowy przepis wejdzie w życie jeszcze przed mistrzostwami świata w USA - powiedział sekretarz generalny FIFA Sepp Blatter w wywiadzie dla belgijskiej gazety "" Het Nieuwsblad "" ."
VERB+ADP	wejdzie	wejść	7	w	w	8	wejdzie w	wejść w	"Jeśli eksperyment powiedzie się , nowy przepis wejdzie w życie jeszcze przed mistrzostwami świata w USA - powiedział sekretarz generalny FIFA Sepp Blatter w wywiadzie dla belgijskiej gazety "" Het Nieuwsblad "" ."
VERB+PRON	skarżyli	skarżyć	15	się	się	16	skarżyli się	skarżyć się	Jak poinformował rzecznik Sony Computer Entertainment , spółki wyspecjalizowanej w produkcji gier , nabywcy konsoli skarżyli się na trudności z odtwarzaniem cyfrowych dysków wideo , DVD .
VERB+PRON	okazała	okazać	1	się	się	2	okazała się	okazać się	Najlepsza okazała się Agnieszka Witamborska ( Wodzisław Śląski ) , która w finale pokonała 3 : 1 Agatę Lindę ( Sulejówek ) .
VERB+PRON	posługiwać	posługiwać	7	się	się	8	posługiwać się	posługiwać się	Jak więc hobbici mogli używać narzędzi i posługiwać się ogniem , czego ślady odkryto na wyspie Flores ?
NOUN+PRON	znęcanie	znęcać	5	się	się	6	znęcanie się	znęcać się	Prokuratura zarzuca 22-letniej matce dziecka znęcanie się ze szczególnym okrucieństwem .
VERB+PRON	ubiegają	ubiegać	5	się	się	6	ubiegają się	ubiegać się	Wreszcie przedstawię polityków , którzy ubiegają się o prezydenturę , i postaram się wytłumaczyć , jak , dlaczego , z czym i za ile stają do tego najbardziej emocjonującego wyścigu politycznego świata .
VERB+PRON	postaram	postarać	11	się	się	12	postaram się	postarać się	Wreszcie przedstawię polityków , którzy ubiegają się o prezydenturę , i postaram się wytłumaczyć , jak , dlaczego , z czym i za ile stają do tego najbardziej emocjonującego wyścigu politycznego świata .
