type	first_word	first_word_lemma	first_word_id	second_word	second_word_lemma	second_word_id	full_mwe	full_mwe_lemma	sentence
NOUN+VERB	garnka	garnek	19	włożyć	włożyć	20	garnka włożyć	garnek włożyć	Przeciętny Polak mógłby mógł by się oburzyć : z czego się cieszyć , skoro on nie ma czego do garnka włożyć ? - zauważa prof . Edmund Wnuk - Lipiński .
PRON+VERB	się	się	6	stało	stać	7	się stało	się stać	Dotąd nie rozumiem , jak to się stało : dla ratowania skóry człowiek może się , widać , zdobyć na wszystko .
ADP+NOUN	w	w	4	stanie	stan	5	w stanie	w stan	Więcej nie jestem już w stanie dokonać .
VERB+PRON	zwrócił	zwrócić	7	się	się	8	zwrócił się	zwrócić się	Rzecznik praw obywatelskich prof . Tadeusz Zieliński zwrócił się do Sądu Najwyższego o rozstrzygnięcie , kto - PKO BP czy skarb państwa - powinien zwaloryzować premie gwarancyjne przysługujące właścicielom książeczek mieszkaniowych .
VERB+NOUN	zrobić	zrobić	9	przykrości	przykrość	10	zrobić przykrości	zrobić przykrość	- Wiesz , że nie chciałam chciała m ci zrobić przykrości .
VERB+PRON	Wyobraźmy	wyobrazić	0	sobie	siebie	1	Wyobraźmy sobie	wyobrazić siebie	Wyobraźmy sobie osobę 20-letnią - nazwijmy ją X . - która rozpoczęła pracę w 1999 r . i zaczyna płacić składki do ZUS .
VERB+PRON	wyłamuje	wyłamywać	4	się	się	5	wyłamuje się	wyłamywać się	"To ktoś , kto wyłamuje się zasadom , regułom , ucieka spod kieratu w którym chodzą wszyscy za obietnicę nagrody , nawet tak błahej jakim jest wyróżnienie w "" wierszach miesiąca "" ."
VERB+PRON	zanosi	zanosić	7	się	się	8	zanosi się	zanosić się	Po tegorocznym wyjątkowo upalnym i suchym lecie zanosi się więc na wyjątkowo gorącą i burzliwą jesień .
VERB+PRON	okazali	okazać	2	się	się	3	okazali się	okazać się	Warszawscy radiowcy okazali się trudnymi rywalami .
VERB+PRON	decyduje	decydować	20	się	się	21	decyduje się	decydować się	Czasami jestem szczerze zdumiona , że mimo zmiany ustawy o prowadzeniu samochodu w stanie nietrzeźwym , tak wiele osób nadal decyduje się na to , aby po „ jednym głębszym ” wsiąść za kierownicę .
VERB+PRON	dostało	dostać	10	się	się	11	dostało się	dostać się	- O ile dobrze wiem , to wielu naszych żołnierzy dostało się do niewoli .
PRON+VERB	się	się	6	pogodzić	pogodzić	7	się pogodzić	się pogodzić	Kto trafi na świecznik , musi się pogodzić z tym , że jest rozliczany za wszystko , co zrobił , a często także i za to , czego nie zrobił .
VERB+PRON	przyczynią	przyczynić	22	się	się	23	przyczynią się	przyczynić się	Nowe przepisy pozwalają policji na rekwirowanie samochodów kierowcom , którzy mają co najmniej 1 promil alkoholu we krwi lub jadąc po pijanemu przyczynią się do spowodowania wypadku drogowego .
NOUN+NOUN	spowodowania	spowodować	25	wypadku	wypadek	26	spowodowania wypadku	spowodować wypadek	Nowe przepisy pozwalają policji na rekwirowanie samochodów kierowcom , którzy mają co najmniej 1 promil alkoholu we krwi lub jadąc po pijanemu przyczynią się do spowodowania wypadku drogowego .
VERB+NOUN	popełnił	popełnić	17	samobójstwo	samobójstwo	18	popełnił samobójstwo	popełnić samobójstwo	W środę 54-letni lekarz , dyrektor miejscowego Wojewódzkiego Szpitala dla Nerwowo i Psychicznie Chorych Jerzy K . popełnił samobójstwo w swoim gabinecie .
VERB+ADP	biorąc	brać	15	pod	pod	16	biorąc pod	brać pod	Po wielu meczach wyjazdowych Obra zbiera niezwykle pochlebne recenzje , ale to niewielka pociecha , biorąc pod uwagę , że liczą się przede wszystkim punkty .
VERB+PRON	liczą	liczyć	20	się	się	21	liczą się	liczyć się	Po wielu meczach wyjazdowych Obra zbiera niezwykle pochlebne recenzje , ale to niewielka pociecha , biorąc pod uwagę , że liczą się przede wszystkim punkty .
ADP+NOUN	do	do	3	czynienia	czynić	4	do czynienia	do czynić	""" Mieli śmy do czynienia ze zdesperowanymi , gotowymi na wszystko , porywaczami , którzy nie chcieli pójść na żadne ustępstwa "" - uzasadnił akcję komandosów minister spraw zagranicznych Nigru Abdourahamane Hama ."
VERB+PRON	doczekać	doczekać	3	się	się	4	doczekać się	doczekać się	Ciągle nie możemy doczekać się takich czasów , kiedy rządy po prostu nie będą przeszkadzały .
VERB+PRON	powołują	powoływać	2	się	się	3	powołują się	powoływać się	Brytyjskie gazety powołują się na korespondencję między amerykańskimi i brytyjskimi służbami specjalnymi FBI i M15 , której odtajnienie nakazał niedawno sąd w USA .
VERB+ADP	ma	mieć	11	w	w	12	ma w	mieć w	Ściągnęła sobie już coś do picia , coś do pogryzania , ma w pogotowiu telefon i łączy się czatem ze swoją psiapsiółką , która też będzie oglądać tego lajwika u siebie w domu .
ADV+VERB	święcie	święcie	25	wierzymy	wierzyć	26	święcie wierzymy	święcie wierzyć	Budujemy nierealistyczne plany i stawiamy sobie zbyt wysokie wymagania , kolekcjonujemy problemy , pozwalamy , by inni nas wykorzystywali lub kierowali nami , no i święcie wierzymy , że wiemy najlepiej , czego potrzebuje nasze dziecko .
PRON+VERB	się	się	16	zdarza	zdarzać	17	się zdarza	się zdarzać	SŁOWNICZEK TRUDNIEJSZYCH WYRAŻEŃ : POLICJA - grupa ludności , która łapie mniej przestępców , niż to się zdarza pozostałym .
VERB+PRON	wydaje	wydawać	9	się	się	10	wydaje się	wydawać się	""" Jeśli połączyć teorię względności z teorią kwantową , wydaje się , że taka możliwość istnieje "" - powiedział Hawking w poniedziałkowym wywiadzie dla gazety "" Sunday Times "" ."
VERB+NOUN	Widział	widzieć	1	kto	kto	2	Widział kto	widzieć kto	- Widział kto , żeby seks stanął komu przy ludziach !
VERB+NOUN	złapie	złapać	5	mróz	mróz	6	złapie mróz	złapać mróz	A co będzie , jak złapie mróz i śnieg przyprószy lód ?
VERB+PRON	stara	starać	11	się	się	12	stara się	starać się	"Nieporozumienie zaczyna się dopiero wtedy , kiedy ów "" ktoś "" stara się swą awersję uzasadniać "" naukowo "" ."
VERB+PRON	staje	stawać	2	się	się	3	staje się	stawać się	- Sytuacja staje się coraz trudniejsza .
VERB+PRON	Biedzili	biedzić	0	się	się	1	Biedzili się	biedzić się	Biedzili się oto nad sprawą , porządkowali zebrany materiał , dedukowali tak i siak , wypisując pytania dodatkowe , na które jeszcze musieli znaleźć odpowiedź , a tu byłej milicjantce najwyraźniej zebrało się na żarty .
VERB+PRON	zebrało	zebrać	31	się	się	32	zebrało się	zebrać się	Biedzili się oto nad sprawą , porządkowali zebrany materiał , dedukowali tak i siak , wypisując pytania dodatkowe , na które jeszcze musieli znaleźć odpowiedź , a tu byłej milicjantce najwyraźniej zebrało się na żarty .
PRON+VERB	się	się	5	pochwalić	pochwalić	6	się pochwalić	się pochwalić	"Poznańska filharmonia od niedawna może się pochwalić wspaniałą złotą "" zdobyczą "" - okazałą harfą pozłacaną 24-karatowym złotem !"
VERB+PRON	domaga	domagać	2	się	się	3	domaga się	domagać się	Tymczasem PiS domaga się od ministra pracy i polityki społecznej Krzysztofa Michałkiewicza odwołania kierownika Urzędu ds . Kombatantów i Osób Represjonowanych Jana Turskiego .
VERB+NOUN	bierze	brać	2	udział	udział	3	bierze udział	brać udział	75 osób bierze udział w trwającej od wczoraj IV Międzynarodowej Wieczerzy Wigilijnej zorganizowanej przez Polskie Stowarzyszenie na rzecz Osób z Upośledzeniem Umysłowym .
VERB+ADP	wyszła	wyjść	15	za	za	16	wyszła za	wyjść za	Toteż usłuchawszy go , rzuciła studia , uciekła od rodziców do profesorskiego domu , wkrótce wyszła za mąż za wykładowcę i urodziła dzieci .
ADJ+NOUN	mający	mieć	25	miejsce	miejsce	26	mający miejsce	mieć miejsce	Tak jak nikt nie debatuje w kwestii konieczności odżywiania , czy odpoczynku , tak samo nie ma sensu włączać coś tak zwykłego jak seks ( mający miejsce pomiędzy ludźmi odpowiadającymi za swoje czyny ) w politykę , ani ideologię .
VERB+PRON	czujemy	czuć	2	się	się	3	czujemy się	czuć się	- Nie czujemy się w tej sprawie winowajcą - zapewnia prezes Burecki .
VERB+PRON	zdają	zdawać	1	sobie	siebie	2	zdają sobie	zdawać siebie	Kierowcy zdają sobie sprawę z tego , że droga hamowania na zimowych oponach jest dużo krótsza , a zimą znacznie rzadziej wpada się na nich w poślizg - mówi Zbigniew Zaława , właściciel szkoły jazdy w Kielcach .
VERB+ADP	Wyszedł	wyjść	0	z	z	1	Wyszedł z	wyjść z	Wyszedł z założenia , że wskazane przez Sellina przepisy ustawy o radiofonii i telewizji - mające stanowić podstawę do wystąpienia o informacje na temat przynależności partyjnej członków zarządów publicznych mediów - takiego prawa nie dają .
VERB+PRON	pozbyć	pozbyć	16	się	się	17	pozbyć się	pozbyć się	- Tak u nas jest , zamiast chronić basen przed dewastacją , lepiej go zasypać i pozbyć się problemu - kwituje Paweł Szymkowicz .
VERB+PRON	Zdarza	zdarzać	1	się	się	2	Zdarza się	zdarzać się	- Zdarza się , że posłowie wykorzystują swój immunitet parlamentarny , by uniknąć odpowiedzialności za wypadek - przyznaje Szkaradek .
VERB+PRON	zgodził	zgodzić	7	się	się	8	zgodził się	zgodzić się	Wicewojewoda Głombiewski ( mieszka w Lęborku ) zgodził się ze stwierdzeniem , że w jego nominacji na to stanowisko można dopatrywać się ukłonu w kierunku nowych obszarów województwa : - Moja praca na tym stanowisku może stać się przyczynkiem do integracji tych terenów - stwierdził .
VERB+PRON	dopatrywać	dopatrywać	20	się	się	21	dopatrywać się	dopatrywać się	Wicewojewoda Głombiewski ( mieszka w Lęborku ) zgodził się ze stwierdzeniem , że w jego nominacji na to stanowisko można dopatrywać się ukłonu w kierunku nowych obszarów województwa : - Moja praca na tym stanowisku może stać się przyczynkiem do integracji tych terenów - stwierdził .
VERB+PRON	stać	stać	36	się	się	37	stać się	stać się	Wicewojewoda Głombiewski ( mieszka w Lęborku ) zgodził się ze stwierdzeniem , że w jego nominacji na to stanowisko można dopatrywać się ukłonu w kierunku nowych obszarów województwa : - Moja praca na tym stanowisku może stać się przyczynkiem do integracji tych terenów - stwierdził .
PRON+VERB	się	się	13	boję	bać	14	się boję	się bać	Powiedział , że chce jeszcze tylko zobaczyć , jak to jest , kiedy się boję .
VERB+PRON	rozległo	rozlec	4	się	się	5	rozległo się	rozlec się	"Zapukał do drzwi , rozległo się krótkie wojskowe : "" wejść ! "" - sierżant otworzył drzwi , wszedł i wyprężył się ."
ADJ+PRON	wybierające	wybierać	2	się	się	3	wybierające się	wybierać się	Nasze reporterki wybierające się z Warszawy na Mazury , już po trzech minutach oczekiwania mogły ruszać w podróż .
VERB+PRON	wywodziła	wywodzić	5	się	się	6	wywodziła się	wywodzić się	Z leżącej niedaleko miejscowości Borki wywodziła się rodzina Wincentego Pola .
VERB+PRON	pluli	pluć	15	sobie	siebie	16	pluli sobie	pluć siebie	Kto , jak nie on , zbił na skajowych portmonetkach fortunkę , podczas gdy inni pluli sobie w brodę , że studia mieli , dyplomy srakie-takie , a na ten prosty pomysł nie wpadli ?
ADP+NOUN	w	w	17	brodę	broda	18	w brodę	w broda	Kto , jak nie on , zbił na skajowych portmonetkach fortunkę , podczas gdy inni pluli sobie w brodę , że studia mieli , dyplomy srakie-takie , a na ten prosty pomysł nie wpadli ?
VERB+PRON	znajdował	znajdować	4	się	się	5	znajdował się	znajdować się	W momencie trafienia śmigłowiec znajdował się na wysokości około 1000 metrów .
VERB+PRON	rozdarł	rozedrzeć	6	się	się	7	rozdarł się	rozedrzeć się	Po chwili zagrzmiała gitara basowa , rozdarł się puzon , beztrosko zadźwięczał keyboard , po czym na podest wypadła ważąca sto trzy kilo Laura Wasąg i ryknęła basem w mikrofon :
NOUN+VERB	Nagrody	nagroda	0	przyznała	przyznać	1	Nagrody przyznała	nagroda przyznać	Nagrody przyznała specjalna Kapituła , pragnąc uhonorować osoby i instytucje , których działalność wniosła znaczący wkład w krzewienie tolerancji .
VERB+PRON	stała	stać	2	się	się	3	stała się	stać się	Ta masakra stała się symbolem , ale zarazem punktem zwrotnym .
VERB+PRON	chwalić	chwalić	14	się	się	15	chwalić się	chwalić się	Młodzi ludzie , którzy za rok , dwa będą pełnoletni , raczej nie będą chwalić się rodzicom swoimi wyczynami i tym , że notorycznie łamali regulamin .
VERB+ADP	są	być	7	w	w	8	są w	być w	Bo chciały uratować zaskrońca , ale teraz są w kropce .
PART+VERB	nie	nie	3	ma	mieć	4	nie ma	nie mieć	W moim przypadku nie ma mowy , żeby m z jakiegokolwiek powodu znów zaczął grać .
PRON+VERB	się	się	1	dowiedzieli	dowiedzieć	2	się dowiedzieli	się dowiedzieć	Jak się dowiedzieli śmy , w czasie zderzenia na wodach , na których doszło do wypadku , nie było jednostek rosyjskich .
VERB+ADP	wyjść	wyjść	9	ze	z	10	wyjść ze	wyjść z	Strażacy i policjanci wezwani na miejsce wypadku nie mogli wyjść ze zdumienia .
PRON+VERB	się	się	4	stało	stać	5	się stało	się stać	Wstrząśnięty wszystkim , co się stało , przestałem przestał em odwiedzać kochankę , a kiedy raz zagadnęła mnie na parkingu , odpowiedziałem odpowiedział em jej coś opryskliwie .
VERB+PRON	dosiadł	dosiąść	5	się	się	6	dosiadł się	dosiąść się	Na parkingu do samochodu Kosińskiego dosiadł się Osiński .
VERB+PRON	śmiali	śmiać	2	się	się	3	śmiali się	śmiać się	I wszyscy śmiali się z podwójnego obowiązku , względem dramatyzującej Jasi i bagatelizującej mamy , co zresztą pani Sierczyńska skwapliwie wykorzystywała , bo człowiek wyczerpany wymuszonym śmiechem zgodzi się na najnudniejszy wykład , byleby tylko mógł chwilę wypocząć od uchachania .
VERB+PRON	zgodzi	zgodzić	27	się	się	28	zgodzi się	zgodzić się	I wszyscy śmiali się z podwójnego obowiązku , względem dramatyzującej Jasi i bagatelizującej mamy , co zresztą pani Sierczyńska skwapliwie wykorzystywała , bo człowiek wyczerpany wymuszonym śmiechem zgodzi się na najnudniejszy wykład , byleby tylko mógł chwilę wypocząć od uchachania .
VERB+PRON	upiera	upierać	1	się	się	2	upiera się	upierać się	Kryśka upiera się : - Chciałaś Chciała ś to zrobić !
PRON+VERB	się	się	17	dzieje	dziać	18	się dzieje	się dziać	Oficer dyżurny Komendy Wojewódzkiej Policji w Gdańsku był wyraźnie zaskoczony , w ogóle nie wiedział , co się dzieje na podległym mu terenie .
VERB+PRON	Stało	stać	0	się	się	1	Stało się	stać się	Stało się jednak inaczej .
PRON+VERB	się	się	3	cieszyć	cieszyć	4	się cieszyć	się cieszyć	Z czego mam się cieszyć , że kości rozsiejemy po świecie ?
VERB+NOUN	złożył	złożyć	3	skargę	skarga	4	złożył skargę	złożyć skarga	W efekcie akcjonariusz złożył skargę w Komisji Europejskiej i zwrócił się do niej o ochronę swoich interesów w Polsce .
VERB+PRON	zwrócił	zwrócić	9	się	się	10	zwrócił się	zwrócić się	W efekcie akcjonariusz złożył skargę w Komisji Europejskiej i zwrócił się do niej o ochronę swoich interesów w Polsce .
ADJ+PRON	zajmujących	zajmować	8	się	się	9	zajmujących się	zajmować się	Zasadą restrukturyzacji jest wyłączenie z firmy jednostek nie zajmujących się taką działalnością .
VERB+PRON	zdarzają	zdarzać	2	się	się	3	zdarzają się	zdarzać się	Ale niekiedy zdarzają się i inne .
VERB+PRON	Spisywał	spisywać	0	się	się	1	Spisywał się	spisywać się	Spisywał się nieco lepiej od poprzedników , ale jego postawa nie znajdowała odzwierciedlenia w wyniku .
VERB+PRON	znalazły	znaleźć	2	się	się	3	znalazły się	znaleźć się	Wśród nagrodzonych znalazły się trzy firmy z woj . kujawsko - pomorskiego .
VERB+NOUN	złożył	złożyć	13	skargę	skarga	14	złożył skargę	złożyć skarga	Z tego powodu policja wezwała na przesłuchanie Michała Lewandowskiego , po czym Lewandowski złożył skargę na policję zarzucając jej brak kultury oraz używanie gróźb wobec jego osoby .
NOUN+NOUN	dokonanie	dokonać	14	zakupów	zakup	15	dokonanie zakupów	dokonać zakup	Warunkiem uzyskania złotej karty , dającej 10-proc . obniżkę na wszystkie towary , było dokonanie zakupów za co najmniej 1500 zł , w ciągu trzech miesięcy .
VERB+NOUN	masz	mieć	1	problemy	problem	2	masz problemy	mieć problem	Jeśli masz problemy z karmieniem , niepokoisz się o dziecko i siebie , o wszystko pytaj , proś o pomoc .
VERB+PRON	niepokoisz	niepokoić	6	się	się	7	niepokoisz się	niepokoić się	Jeśli masz problemy z karmieniem , niepokoisz się o dziecko i siebie , o wszystko pytaj , proś o pomoc .
VERB+PRON	opłaca	opłacać	2	się	się	3	opłaca się	opłacać się	PiS-owi nie opłaca się koalicja z PO .
VERB+PRON	niepokoił	niepokoić	10	się	się	11	niepokoił się	niepokoić się	- A jak on skoczy mu do gardła ? - niepokoił się Janusz .
VERB+NOUN	pełnić	pełnić	3	straż	straż	4	pełnić straż	pełnić straż	On tu miał pełnić straż .
ADP+NOUN	do	do	18	udziału	udział	19	do udziału	do udział	Japońscy mistrzowie sumo , stanowiący niewątpliwie wizytówkę tego kraju , zostali zaproszeni przez organizatorów zimowych igrzysk w Nagano do udziału w ceremonii otwarcia .
VERB+ADP	pozostawał	pozostawać	16	w	w	17	pozostawał w	pozostawać w	Nigdy nie zauważyłem zauważył em , by padał na mnie jakiś cień , bym by m pozostawał w czyimś cieniu .
PRON+VERB	się	się	9	wydaje	wydawać	10	się wydaje	się wydawać	Ile jeszcze naród będzie bulił za to że chamom się wydaje że im się należy ?
PRON+VERB	się	się	13	należy	należeć	14	się należy	się należeć	Ile jeszcze naród będzie bulił za to że chamom się wydaje że im się należy ?
VERB+NOUN	rozkłada	rozkładać	6	ręce	ręka	7	rozkłada ręce	rozkładać ręka	Nic więcej powiedzieć nie mogę - rozkłada ręce .
VERB+PRON	uśmiechnie	uśmiechnąć	4	się	się	5	uśmiechnie się	uśmiechnąć się	– Sto pięćdziesiąt – uśmiechnie się Cameron .
VERB+NOUN	wiodła	wieść	10	prym	prym	11	wiodła prym	wieść prym	Para taneczna klasy S : Małgorzata Piasna i Konrad Szymański wiodła prym na rozegranych w sobotę I Mistrzostwach Okręgu Łódzkiego w tańcu towarzyskim .
VERB+PRON	Bał	bać	0	się	się	1	Bał się	bać się	Bał się jednak , czy ze złości , że ich przestraszył , nie porąbią jego głowy na kawałki , jeśli wyjawi im prawdę .
VERB+NOUN	popełniały	popełniać	17	zbrodnię	zbrodnia	18	popełniały zbrodnię	popełniać zbrodnia	Władcę szczególnie bulwersowało to , że występowały one niejako w męskiej roli : nie dość , że popełniały zbrodnię , to jeszcze naruszały przy tym obyczajowe tabu związane z podziałem płci .
VERB+NOUN	brał	brać	10	udział	udział	11	brał udział	brać udział	"Dwóch z oskarżonych stwierdziło , że co prawda nowo osadzony brał udział w "" więziennych gierkach "" , ale nikt go do tego nie zmuszał ."
VERB+NOUN	przeprowadziła	przeprowadzić	4	działania	działanie	5	przeprowadziła działania	przeprowadzić działanie	Straż Rybacka 28 czerwca przeprowadziła działania przeciwko kłusownikom na rzece Parsęcie .
NOUN+NOUN	prowadzeniu	prowadzić	18	działalności	działalność	19	prowadzeniu działalności	prowadzić działalność	Z raportu wynika , że do 2010 r . ponad trzykrotnie wzrośnie zapotrzebowanie na agentów biur pomagających w prowadzeniu działalności gospodarczej i agentów handlowych .
VERB+NOUN	odbywają	odbywać	11	tarło	tarło	12	odbywają tarło	odbywać tarło	Gdy niektóre gatunki ryb podążają na miejsca zimowego odpoczynku , inne odbywają tarło .
VERB+PRON	zajęli	zająć	7	się	się	8	zajęli się	zająć się	Sprawą włamania do domu wokalistki Blue Cafe zajęli się policjanci z komisariatu przy ul . Ciesielskiej .
VERB+PRON	zjawili	zjawić	3	się	się	4	zjawili się	zjawić się	Gdy na miejscu zjawili się policjanci z komisariatu kolejowego policji , schronisko znajdowało się w opłakanym stanie .
VERB+PRON	znajdowało	znajdować	12	się	się	13	znajdowało się	znajdować się	Gdy na miejscu zjawili się policjanci z komisariatu kolejowego policji , schronisko znajdowało się w opłakanym stanie .
VERB+PRON	podjął	podjąć	1	się	się	2	podjął się	podjąć się	RPO podjął się zbadania sprawy .
VERB+ADP	będzie	być	24	w	w	25	będzie w	być w	- Nie ma wątpliwości , że dla takiego banku jak Handlowy , skupionego na pewnej grupie klientów , nie jest bez znaczenia , czy będzie w stanie przekształcić się w bank uniwersalny , świadczący usługi zarówno dla przedsiębiorstw , jak i dla ludności .
ADJ+NOUN	świadczący	świadczyć	33	usługi	usługa	34	świadczący usługi	świadczyć usługa	- Nie ma wątpliwości , że dla takiego banku jak Handlowy , skupionego na pewnej grupie klientów , nie jest bez znaczenia , czy będzie w stanie przekształcić się w bank uniwersalny , świadczący usługi zarówno dla przedsiębiorstw , jak i dla ludności .
VERB+NOUN	dokonał	dokonać	1	czynów	czyn	2	dokonał czynów	dokonać czyn	Tam dokonał czynów lubieżnych na dziewczynce .
VERB+PRON	znalazła	znaleźć	10	się	się	11	znalazła się	znaleźć się	W 1966 w konkursie magazynu turystycznego „ Światowid ’ ’ znalazła się na liście laureatów konkursu „ 7 pereł architektury polskiej ’ ’ .
VERB+PRON	pojawia	pojawiać	21	się	się	22	pojawia się	pojawiać się	Jeśli Tarnowskie Góry czy Będzin aspirują do tego , żeby uwzględnić je w planach utworzenia miasta „ Silesia ” , to pojawia się pytanie , czy nie zostaną w przyszłości zmienione granice administracyjne powiatów – dodaje Józef Korpak , starosta tarnogórski .
VERB+PRON	wyłamują	wyłamywać	32	się	się	33	wyłamują się	wyłamywać się	Kiedy jednak przyjrzałem przyjrzał em się poszczególnym sprawom , to pojąłem pojął em , jak bardzo są one skomplikowane – jak proste są ustawione rzędem tabele cyfr , ale jak losy ludzi wyłamują się ze statystyk .
VERB+PRON	zajęli	zająć	10	się	się	11	zajęli się	zająć się	Słyszeli , że niedaleko jest grupa młodych ludzi , ale zajęli się sobą .
VERB+ADP	wyszło	wyjść	7	z	z	8	wyszło z	wyjść z	Właśnie teraz , kiedy opalanie już dawno wyszło z mody , potrzebuje ich twoja skóra , oczy , usta , a także włosy , abyś aby ś latem promieniała ciepłymi , opalizującymi kolorami natury .
VERB+PRON	prezentują	prezentować	5	się	się	6	prezentują się	prezentować się	Dogi z hodowli Jadwigi Szłapki prezentują się dobrze nie tylko na wystawowych ringach , ale też . . . w obiektywie kamer .
VERB+PRON	śmieją	śmiać	4	się	się	5	śmieją się	śmiać się	Gadają na wyścigi , śmieją się i całują , żartują z oberżystą i znowu rozmawiają , a radość kipi w nich jak słodki czerwony sok burzący się na słońcu w zakorkowanych butelkach .
VERB+NOUN	udzielić	udzielić	7	zgody	zgoda	8	udzielić zgody	udzielić zgoda	Pragnę podziękować też artystom , którzy zechcieli udzielić zgody na nieodpłatną reprodukcję ich obrazów w tej publikacji , przede wszystkim Jerzemu Dudzie - Graczowi , a także Kazimierzowi Mikulskiemu i Marianowi Kępińskiemu .
VERB+PRON	wstydzą	wstydzić	1	się	się	2	wstydzą się	wstydzić się	Może wstydzą się , że go opuścili ?
VERB+ADP	wodził	wodzić	4	za	za	5	wodził za	wodzić za	Pochodzący z Rumunii ślusarz wodził za nos policję i dyrekcję niemieckiej filii szwajcarskiego koncernu żywnościowego Nestle , podrzucając do sklepów na terenie Niemiec zatrute cyjanowodorem ( kwasem cyjanowodorowym zwanym też pruskim ) sosy , musztardę i majonez marki Thomy .
VERB+PRON	wyzbywają	wyzbywać	3	się	się	4	wyzbywają się	wyzbywać się	Sąsiednie kraje nie wyzbywają się majątku , szczególnie strategicznego , im się to opłaca .
VERB+NOUN	mam	mieć	3	nadzieję	nadzieja	4	mam nadzieję	mieć nadzieja	- Ja też mam nadzieję - potwierdził , zmierzając do stolika Margit .
ADP+NOUN	w	w	5	skład	skład	6	w skład	w skład	Miał też pić miksturę , w skład której wchodził m.in . proszek do prania .
VERB+PRON	dziwi	dziwić	20	się	się	21	dziwi się	dziwić się	- Jaki bowiem przykład demokracji , ładu , rozsądku i odpowiedzialności dajemy teraz - nie tylko przecież Białorusinom ? - dziwi się pan K .
VERB+PRON	odwołując	odwoływać	16	się	się	17	odwołując się	odwoływać się	Nowy hatchback , którego nazwa współbrzmi z nazwami innych modeli Toyoty ( Yaris i Avensis ) odwołując się jednocześnie do złota , zadebiutuje na europejskim rynku w pierwszym kwartale 2007 .
VERB+NOUN	doznało	doznać	12	urazów	uraz	13	doznało urazów	doznać uraz	"Cała siedmioosobowa załoga "" Kani "" ocalała , ale trzech najciężej rannych doznało urazów kręgosłupa ."
VERB+PRON	znajduje	znajdować	12	się	się	13	znajduje się	znajdować się	Działka przy ul . Wojska Polskiego w Pile i wszystko , co znajduje się na niej , jest więc własnością komunalną .
VERB+NOUN	miały	mieć	6	kształt	kształt	7	miały kształt	mieć kształt	Odpowiednio do tego , łóżka także miały kształt łukowaty .
VERB+PRON	Zajął	zająć	0	się	się	1	Zajął się	zająć się	"Zajął się natomiast Elisą Smarth , dziewczyną , która miejscowemu dealerowi "" SoftPenny "" pomagała przy doręczaniu klientom towarów - i z naiwną wiarą w możliwości współczesnej techniki , traktował ją , jak zamówioną przez siebie lalkę ."
